[
        {
            "address": "0x333f2e9f074de56d3ed6a0518c3d0df418692b63",
            "chain": "ethereum_mainnet",
            "entity": "",
            "name": "",
            "categories": [
                "honeypot",
                "phishing",
                "theft"
            ],
            "source": "ground_truth",
            "submitted_by": "GoPlus",
            "submitted_on": "2023-02-14 16:00:09"
        },
        {
            "address": "0xec117f9066a8ad1caef190372ee7560f04d997dd",
            "chain": "ethereum_mainnet",
            "entity": "",
            "name": "",
            "categories": [
                "honeypot",
                "phishing",
                "high_risk"
            ],
            "source": "ground_truth",
            "submitted_by": "GoPlus",
            "submitted_on": "2023-03-06 06:41:44"
        }
    ]
